<!ELEMENT catalog (function+)>
<!ELEMENT function (name,option*,Description)>
<!ATTLIST function id NMTOKEN #REQUIRED>
<!ELEMENT name (#PCDATA)>
<!ELEMENT option (#PCDATA)>
<!ELEMENT Description EMPTY>
